"date","title","link","description","cve","cvss"
"2025/11/12","""K000157365: Moment vulnerability CVE-2022-31129""","https://my.f5.com/manage/s/article/K000157365?utm_source=f5support&utm_medium=RSS","""""Security Advisory Description moment is a JavaScript date library for parsing, validating, manipulating, and formatting dates. Affected versions of moment were found to use an inefficient parsing ...""""","""""",""""""
"2025/11/10","""K000139553: VPN TunnelVision vulnerability CVE-2024-3661""","https://my.f5.com/manage/s/article/K000139553?utm_source=f5support&utm_medium=RSS","""""Security Advisory Description By design, the DHCP protocol does not authenticate messages, including for example the classless static route option (121). An attacker with the ability to send DHCP ...""""","""""",""""""
"2025/11/10","""K000157341: Linux kernel vulnerability CVE-2025-21887""","https://my.f5.com/manage/s/article/K000157341?utm_source=f5support&utm_medium=RSS","""""Security Advisory Description In the Linux kernel, the following vulnerability has been resolved: ovl: fix UAF in ovl_dentry_update_reval by moving dput() in ovl_link_up The issue was caused by ...""""","""""",""""""
"2025/11/08","""K12201527: Overview of Quarterly Security Notifications""","https://my.f5.com/manage/s/article/K12201527?utm_source=f5support&utm_medium=RSS","""""Security Advisory Description F5 discloses security vulnerabilities and security exposures for F5 products in Quarterly Security Notifications (QSNs). The dates of future QSNs are published in ...""""","""""",""""""
"2025/11/08","""K000157334: BIND vulnerability CVE-2025-40778""","https://my.f5.com/manage/s/article/K000157334?utm_source=f5support&utm_medium=RSS","""""Security Advisory Description Under certain circumstances, BIND is too lenient when accepting records from answers, allowing an attacker to inject forged data into the cache. This issue affects ...""""","""""",""""""
"2025/11/07","""K000157321: Intel 700 Series Ethernet vulnerability CVE-2025-24486""","https://my.f5.com/manage/s/article/K000157321?utm_source=f5support&utm_medium=RSS","""""Security Advisory Description Improper input validation in the Linux kernel-mode driver for some Intel(R) 700 Series Ethernet before version 2.28.5 may allow an authenticated user to potentially ...""""","""""",""""""
"2025/11/07","""K000157322: Linux kernel vulnerability CVE-2025-8941""","https://my.f5.com/manage/s/article/K000157322?utm_source=f5support&utm_medium=RSS","""""Security Advisory Description A flaw was found in linux-pam. The pam_namespace module may improperly handle user-controlled paths, allowing local users to exploit symlink attacks and race ...""""","""""",""""""
"2025/11/07","""K000157330: Intel 700 Series Ethernet vulnerability CVE-2025-25273""","https://my.f5.com/manage/s/article/K000157330?utm_source=f5support&utm_medium=RSS","""""Security Advisory Description Insufficient control flow management in the Linux kernel-mode driver for some Intel(R) 700 Series Ethernet before version 2.28.5 may allow an authenticated user to ...""""","""""",""""""
"2025/11/07","""K000157317: BIND vulnerability CVE-2025-8677""","https://my.f5.com/manage/s/article/K000157317?utm_source=f5support&utm_medium=RSS","""""Security Advisory Description Querying for records within a specially crafted zone containing certain malformed DNSKEY records can lead to CPU exhaustion. This issue affects BIND 9 versions 9.18.0 ...""""","""""",""""""
"2025/11/06","""K58243048: Considerations for transferring files from F5 devices""","https://my.f5.com/manage/s/article/K58243048?utm_source=f5support&utm_medium=RSS","""""Security Advisory Description The BIG-IP system uses Secure Vault, a secure SSL-encrypted storage system, to securely store sensitive data such as SSL key passphrases, users, and administrator and ...""""","""""",""""""
"2025/11/05","""""""""""""""""""""""""""""""K49419538: libxml2 vulnerability CVE-2016-4658""""""""""""""""""""""""""""""","https://my.f5.com/manage/s/article/K49419538?utm_source=f5support&utm_medium=RSS","""""""""""""""""""""""""""""""""Security Advisory Description xpointer.c in libxml2 before 2.9.5 (as used in Apple iOS before 10, OS X before 10.12, tvOS before 10, and watchOS before 3, and other products) does not forbid ...""""""""""""""""""""""""""""""""","""""""""""""""""""""""""""""""""""""""""""""""""""""""""""""",""""""""""""""""""""""""""""""""""""""""""""""""""""""""""""""
