"date","title","link","description","cve","cvss"
"2025/11/30","""Laravel Live Japan""","https://laravellive.jp","""Laravel Live Japan is the first official Laravel community conference in Japan. It brings together developers, designers, and tech enthusiasts from around the world to share knowledge, exchange ideas, and celebrate the craft of building with Laravel. Join us in Tokyo at Tachikawa Stage Garden on May 26-27, 2026 for this premiere event. Enjoy two days of inspiring talks, hands-on learning, and unforgettable community experiences. Basic infoDate: May 26-27, 2026 (JST) Location: Tachikawa City, Tokyo Prefecture, JapanLinksWebsite: https://laravellive.jp X: https://x.com/LaravelLiveJP""","""""",""""""
"2025/11/20","""PHP 8.3.28 Released!""","https://www.php.net/archive/2025.php#2025-11-20-1","""The PHP development team announces the immediate availability of PHP 8.3.28. This is a bug fix release. All PHP 8.3 users are encouraged to upgrade to this version. For source downloads of PHP 8.3.28 please visit our downloads page, Windows source and binaries can also be found there. The list of changes is recorded in the ChangeLog.""","""""",""""""
"2025/11/20","""PHP 8.4.15 Released!""","https://www.php.net/archive/2025.php#2025-11-20-2","""The PHP development team announces the immediate availability of PHP 8.4.15. This is a bug fix release. All PHP 8.4 users are encouraged to upgrade to this version. For source downloads of PHP 8.4.15 please visit our downloads page, Windows source and binaries can also be found there. The list of changes is recorded in the ChangeLog.""","""""",""""""
"2025/11/20","""PHP 8.5.0 Released!""","https://www.php.net/archive/2025.php#2025-11-20-3","""The PHP development team announces the immediate availability of PHP 8.5.0. This release marks the latest minor release of the PHP language. PHP 8.5 comes with numerous improvements and new features such as:New ""URI"" extension New pipe operator (|>) Clone With New #[\NoDiscard] attribute Support for closures, casts, and first class callables in constant expressions And much much more... For source downloads of PHP 8.5.0 please visit our downloads page, Windows source and binaries can also be found there. The list of changes is recorded in the ChangeLog. The migration guide is available in the PHP Manual. Please consult it for the detailed list of new features and backward incompatible changes.Kudos to all the contributors and supporters!""","""""",""""""
"2025/11/13","""""""""""""""""""""""""""""""""""""""""""""""""""""""""""""PHP 8.5.0 RC 5 available for testing""""""""""""""""""""""""""""""""""""""""""""""""""""""""""""","https://www.php.net/archive/2025.php#2025-11-13-1","""""""""""""""""""""""""""""""""""""""""""""""""""""""""""""The PHP team is pleased to announce the fifth release candidate of PHP 8.5.0, RC 5.This continues the PHP 8.5 release cycle, the rough outline of which is specified in thePHP Wiki. For source downloads of PHP 8.5.0 RC5, please visit the download page. Please carefully test this version and report any issues found on GitHub. Please DO NOT use this version in production, it is a test version. For more information on the new features and other changes, you can read the NEWS file, or the UPGRADING file for a complete list of upgrading notes. These files can also be found in the release archive. The next release will be the GA release of PHP 8.5.0, planned for 20 Nov 2025. The signatures for the release can be found in the manifest or on the Release Candidates page. Thank you for helping us make PHP better.""""""""""""""""""""""""""""""""""""""""""""""""""""""""""""","""""""""""""""""""""""""""""""""""""""""""""""""""""""""""""""""""""""""""""""""""""""""""""""""""""""""""""""""""""""""",""""""""""""""""""""""""""""""""""""""""""""""""""""""""""""""""""""""""""""""""""""""""""""""""""""""""""""""""""""""""""
"2025/11/06","""""""""""""""""""""""""""""""""""""""""""""""""""""""""""""""""""""""""""""""""""""""""""""""""""""""""""""""""""""""""""""""""""""""""""""""""""""""""""""""""""""""""""""""""""""""""""""""""""""""""""""""""""""""""""""""""""""""""""""""""""""""""PHP 8.5.0 RC4 available for testing""""""""""""""""""""""""""""""""""""""""""""""""""""""""""""""""""""""""""""""""""""""""""""""""""""""""""""""""""""""""""""""""""""""""""""""""""""""""""""""""""""""""""""""""""""""""""""""""""""""""""""""""""""""""""""""""""""""""""""""""""""""""","https://www.php.net/archive/2025.php#2025-11-06-1","""""""""""""""""""""""""""""""""""""""""""""""""""""""""""""""""""""""""""""""""""""""""""""""""""""""""""""""""""""""""""""""""""""""""""""""""""""""""""""""""""""""""""""""""""""""""""""""""""""""""""""""""""""""""""""""""""""""""""""""""""""""""The PHP team is pleased to announce the final planned release candidate of PHP 8.5.0, RC 4.This continues the PHP 8.5 release cycle, the rough outline of which is specified in thePHP Wiki. For source downloads of PHP 8.5.0 RC4, please visit the download page. Please carefully test this version and report any issues found on GitHub. Please DO NOT use this version in production, it is a test version. For more information on the new features and other changes, you can read the NEWS file, or the UPGRADING file for a complete list of upgrading notes. These files can also be found in the release archive. The next release will be the GA release of PHP 8.5.0, planned for 20 Nov 2025. The signatures for the release can be found in the manifest or on the Release Candidates page. Thank you for helping us make PHP better.""""""""""""""""""""""""""""""""""""""""""""""""""""""""""""""""""""""""""""""""""""""""""""""""""""""""""""""""""""""""""""""""""""""""""""""""""""""""""""""""""""""""""""""""""""""""""""""""""""""""""""""""""""""""""""""""""""""""""""""""""""""""","""""""""""""""""""""""""""""""""""""""""""""""""""""""""""""""""""""""""""""""""""""""""""""""""""""""""""""""""""""""""""""""""""""""""""""""""""""""""""""""""""""""""""""""""""""""""""""""""""""""""""""""""""""""""""""""""""""""""""""""""""""""""""""""""""""""""""""""""""""""""""""""""""""""""""""""""""""""""""""""""""""""""""""""""""""""""""""""""""""""""""""""""""""""""""""""""""""""""""""""""""""""""""""""""""""""""""""""""""""""""""""""""""""""""""""""""""""""""""""""""""""""""""""""""",""""""""""""""""""""""""""""""""""""""""""""""""""""""""""""""""""""""""""""""""""""""""""""""""""""""""""""""""""""""""""""""""""""""""""""""""""""""""""""""""""""""""""""""""""""""""""""""""""""""""""""""""""""""""""""""""""""""""""""""""""""""""""""""""""""""""""""""""""""""""""""""""""""""""""""""""""""""""""""""""""""""""""""""""""""""""""""""""""""""""""""""""""""""""""""""""""""""""""""""""""""""""""""""""""""""""""""""""""""""""""""""""""""""""""""""""""""""""""""""""""""""""""""""""""
