"date","title","link","description","cve","cvss"
"2025/08/28","""PHP 8.4.12 Released!""","https://www.php.net/archive/2025.php#2025-08-28-1","""The PHP development team announces the immediate availability of PHP 8.4.12. This is a bug fix release. All PHP 8.4 users are encouraged to upgrade to this version. For source downloads of PHP 8.4.12 please visit our downloads page, Windows source and binaries can be found on windows.php.net/download/. The list of changes is recorded in the ChangeLog.""","""""",""""""
"2025/08/28","""PHP 8.3.25 Released!""","https://www.php.net/archive/2025.php#2025-08-28-2","""The PHP development team announces the immediate availability of PHP 8.3.25. This is a bug fix release. All PHP 8.3 users are encouraged to upgrade to this version. For source downloads of PHP 8.3.25 please visit our downloads page, Windows source and binaries can be found on windows.php.net/download/. The list of changes is recorded in the ChangeLog.""","""""",""""""
"2025/08/28","""PHP 8.5.0 Beta 2 available for testing""","https://www.php.net/archive/2025.php#2025-08-28-3","""The PHP team is pleased to announce the second beta release of PHP 8.5.0, Beta 2.This continues the PHP 8.5 release cycle, the rough outline of which is specified in thePHP Wiki. For source downloads of PHP 8.5.0 Beta 2 please visit the download page. Please carefully test this version and report any issues found on GitHub. Please DO NOT use this version in production, it is an early test version. For more information on the new features and other changes, you can read the NEWS file, or the UPGRADING file for a complete list of upgrading notes. These files can also be found in the release archive. The next release will be Beta 3, planned for 11 Sep 2025. The signatures for the release can be found in the manifest or on the Release Candidates page. Thank you for helping us make PHP better.""","""""",""""""
"2025/08/25","""PHPeste 2025 - Parnaiba-PI""","https://www.php.net/archive/2025.php#2025-08-25-1","""About the Conference Introducing PHPeste, a distinguished PHP conference, championed by the resilient communities of Brazil's Northeast. Over the years, this event has graced cities including João Pessoa, Salvador, São Luis, Recife, Natal, Fortaleza. Spanning two enriching days, attendees can anticipate:Comprehensive Learning: Dive deep into the world of PHP through hands-on sessions and workshops. Networking Opportunities: Engage with passionate PHP enthusiasts and professionals who embody the spirit and vigor of the Northeast. Expert Speakers: Gain insights from an array of top-tier industry speakers, sharing their expertise and experiences.PHPeste is a collaborative effort by communities from various Northeastern states, including Alagoas, Bahia, Ceará, Maranhão, Paraíba, Pernambuco, Rio Grande do Norte, and Sergipe. This year, the ""PHP Piaui"" community takes the helm, ensuring that the event remains both high-quality and accessible. Thanks to the tireless efforts of our volunteer members, we are able to provide an exceptional experience at a cost-effective price, making this conference accessible to many. Date: October 3-4, 2025 in Parnaiba, Piaui.Location: UESPI University of Piaui | Av. Nossa Sra. de Fátima, s/n - Nossa Sra. de Fátima, Parnaíba - PI, 64202-220 For more information about the event, visit the website: PHPeste""","""""",""""""
"2025/08/20","""Longhorn PHP 2025""","https://longhornphp.com/schedule","""Longhorn PHP is back for 2025 - and our schedule and speakers list is now live! The conference will be held in Austin, Texas, and will start with an optional tutorial day on Thursday, October 23, followed by two days full of talks and keynotes plus open spaces and more, on Friday and Saturday, October 24-25. Longhorn PHP is a regional community run conference, designed to help PHP developers level up their craft and connect with the larger PHP community. Our full schedule is available now.""","""""",""""""
"2025/08/14","""PHP 8.5.0 Beta 1 available for testing""","https://www.php.net/archive/2025.php#2025-08-14-1","""The PHP team is pleased to announce the first beta release of PHP 8.5.0, Beta 1. This continues the PHP 8.5 release cycle, the rough outline of which is specified in the PHP Wiki. For source downloads of PHP 8.5.0 Beta 1 please visit the download page. Please carefully test this version and report any issues found on GitHub. Please DO NOT use this version in production, it is an early test version. For more information on the new features and other changes, you can read the NEWS file, or the UPGRADING file for a complete list of upgrading notes. These files can also be found in the release archive. The next release will be Beta 2, planned for 28 Aug 2025. The signatures for the release can be found in the manifest or on the Release Candidates page. Thank you for helping us make PHP better.""","""""",""""""
"2025/08/10","""""""""""""""""""""""""""""""""""""""""""""""""""""""""""""""""""""""""""""""""""""""PHP Tek 2026""""""""""""""""""""""""""""""""""""""""""""""""""""""""""""""""""""""""""""""""""""""","https://sessionize.com/php-tek-2026/","""""""""""""""""""""""""""""""""""""""""""""""""""""""""""""""""""""""""""""""""""""""Join us for the 18th Annual Web Developer Conference, PHP Tek 2026, May 19-21 2026. PHP Tek combines leadership, expertise, and networking in one event. A relaxingatmosphere for tech leaders and developers to share, learn and grow professionally whilealso providing you with the knowledge to solve your everyday problems. We are the longest-running web developer conference in the United States, focusing on thePHP programming language. The event is broken up into multiple days. The main conferencehappens over the course of 3 days (May 19-21) and includes keynotes, talks, and networkingoptions. It will be broken into four tracks this year and will cover a range of topics. Head over to https://phptek.io and get yours today!""""""""""""""""""""""""""""""""""""""""""""""""""""""""""""""""""""""""""""""""""""""","""""""""""""""""""""""""""""""""""""""""""""""""""""""""""""""""""""""""""""""""""""""""""""""""""""""""""""""""""""""""""""""""""""""""""""""""""""""""""""""""""""""""""""",""""""""""""""""""""""""""""""""""""""""""""""""""""""""""""""""""""""""""""""""""""""""""""""""""""""""""""""""""""""""""""""""""""""""""""""""""""""""""""""""""""""""""""""
"2025/08/08","""""""""""""""""""""""""""""""""""""""""""""""""""""""""""""""""""""""""""""""""""""""""""""""""""""""""""""""""""""""""""""""""ConFoo Montreal 2026: Call for Papers""""""""""""""""""""""""""""""""""""""""""""""""""""""""""""""""""""""""""""""""""""""""""""""""""""""""""""""""""""""""""""""""","https://confoo.ca/en/2026","""""""""""""""""""""""""""""""""""""""""""""""""""""""""""""""""""""""""""""""""""""""""""""""""""""""""""""""""""""""""""""""""ConFoo is a multi-technology conference specifically crafted for tech professionals. Whether you’re a developer, architect or a CTO, this conference wishes to bring an outstanding diversity of content to expand your knowledge, increase your productivity and boost your development skills. With over 170 presentations, offered by local and international speakers, you’re sure to level up your skills and more! You’re a leader in your field and wish to share your wisdom? Want to be part of our 2026 lineup? Want to demonstrate how human intelligence is changing our industry?The team at ConFoo is looking for speakers and conference proposals for its 2026 event in Montreal. Our conferences are both dynamic and educational and are set to challenge our participants. We usually recommend a 45-minute format, including a 10 Q&A session at the end. Checkout last year conference schedule to get an idea of what you can expect. You have until September 21 to submit your proposals. Until then, participants can enjoy a 300$ discount on their registration!""""""""""""""""""""""""""""""""""""""""""""""""""""""""""""""""""""""""""""""""""""""""""""""""""""""""""""""""""""""""""""""""","""""""""""""""""""""""""""""""""""""""""""""""""""""""""""""""""""""""""""""""""""""""""""""""""""""""""""""""""""""""""""""""""""""""""""""""""""""""""""""""""""""""""""""""""""""""""""""""""""""""""""""""""""""""""""""""""""""""""""""""""""""""""""""""""",""""""""""""""""""""""""""""""""""""""""""""""""""""""""""""""""""""""""""""""""""""""""""""""""""""""""""""""""""""""""""""""""""""""""""""""""""""""""""""""""""""""""""""""""""""""""""""""""""""""""""""""""""""""""""""""""""""""""""""""""""""""""""""""""""
"2025/08/01","""""""""""""""""""""""""""""""""""""""""""""""""""""""""""""""""""""""""""""""""""""""""""""""""""""""""""""""""""""""""""""""""""""""""""""""""""""""""""""""""""""""""""""""""""""""""""""""""""""""""""""""""""""""""""""""""""""""""""""""""""""""""""""""""""""""""""""""""""""""""""""""""""""""""""""""""""""""""""""""""""""""""""""""""""""""""""""""""""""""""""PHP 8.5.0 Alpha 4 available for testing""""""""""""""""""""""""""""""""""""""""""""""""""""""""""""""""""""""""""""""""""""""""""""""""""""""""""""""""""""""""""""""""""""""""""""""""""""""""""""""""""""""""""""""""""""""""""""""""""""""""""""""""""""""""""""""""""""""""""""""""""""""""""""""""""""""""""""""""""""""""""""""""""""""""""""""""""""""""""""""""""""""""""""""""""""""""""""""""""""""""""","https://www.php.net/archive/2025.php#2025-07-31-3","""""""""""""""""""""""""""""""""""""""""""""""""""""""""""""""""""""""""""""""""""""""""""""""""""""""""""""""""""""""""""""""""""""""""""""""""""""""""""""""""""""""""""""""""""""""""""""""""""""""""""""""""""""""""""""""""""""""""""""""""""""""""""""""""""""""""""""""""""""""""""""""""""""""""""""""""""""""""""""""""""""""""""""""""""""""""""""""""""""""""""The PHP team is pleased to announce the third testing release of PHP 8.5.0, Alpha 4. This continues the PHP 8.5 release cycle, the rough outline of which is specified in the PHP Wiki.For source downloads of PHP 8.5.0 Alpha 4 please visit the download page. Please carefully test this version and report any issues found on GitHub. Please DO NOT use this version in production, it is an early test version. For more information on the new features and other changes, you can read the NEWS file, or the UPGRADING file for a complete list of upgrading notes. These files can also be found in the release archive. The next release will be Beta 1, planned for 14 Aug 2025. The signatures for the release can be found in the manifest or on the Release Candidates page. Thank you for helping us make PHP better.""""""""""""""""""""""""""""""""""""""""""""""""""""""""""""""""""""""""""""""""""""""""""""""""""""""""""""""""""""""""""""""""""""""""""""""""""""""""""""""""""""""""""""""""""""""""""""""""""""""""""""""""""""""""""""""""""""""""""""""""""""""""""""""""""""""""""""""""""""""""""""""""""""""""""""""""""""""""""""""""""""""""""""""""""""""""""""""""""""""""""","""""""""""""""""""""""""""""""""""""""""""""""""""""""""""""""""""""""""""""""""""""""""""""""""""""""""""""""""""""""""""""""""""""""""""""""""""""""""""""""""""""""""""""""""""""""""""""""""""""""""""""""""""""""""""""""""""""""""""""""""""""""""""""""""""""""""""""""""""""""""""""""""""""""""""""""""""""""""""""""""""""""""""""""""""""""""""""""""""""""""""""""""""""""""""""""""""""""""""""""""""""""""""""""""""""""""""""""""""""""""""""""""""""""""""""""""""""""""""""""""""""""""""""""""""""""""""""""""""""""""""""""""""""""""""""""""""""""""""""""""""""""""""""""""""""""""""""""""""""""""""""""""""""""""""""""""""""""""""""""""""""""""""""""""""""""""""""""""""""""""""""""""""""""""""""""""""""""""""""""""""""",""""""""""""""""""""""""""""""""""""""""""""""""""""""""""""""""""""""""""""""""""""""""""""""""""""""""""""""""""""""""""""""""""""""""""""""""""""""""""""""""""""""""""""""""""""""""""""""""""""""""""""""""""""""""""""""""""""""""""""""""""""""""""""""""""""""""""""""""""""""""""""""""""""""""""""""""""""""""""""""""""""""""""""""""""""""""""""""""""""""""""""""""""""""""""""""""""""""""""""""""""""""""""""""""""""""""""""""""""""""""""""""""""""""""""""""""""""""""""""""""""""""""""""""""""""""""""""""""""""""""""""""""""""""""""""""""""""""""""""""""""""""""""""""""""""""""""""""""""""""""""""""""""""""""""""""""""""""""""""""""""""""""""""""""""""""""""""""""""""""""""""""""""""""""""""""""""""""""""""""""""""""
